{
  "id": "mimi-kitten",
  "species": "kitten",
  "nameKey": "animal.mimi-kitten.name",
  "shelterAreaId": "indoor-room",
  "shelterLocalization": {
    "happyKey": "animal.mimi-kitten.shelter.happy",
    "tapLabelKey": "animal.mimi-kitten.shelter.tap-label"
  },
  "assets": {
    "portrait": "images/residents/mimi/canonical.png",
    "idle": "images/residents/mimi/shelter-idle.png",
    "happy": "images/residents/mimi/celebration.png",
    "mission": "images/residents/mimi/mission.png"
  },
  "shelterReactions": ["greet", "pet", "play"]
}
